{"$schema":"https://json-schema.org/draft/2020-12/schema","additionalProperties":false,"properties":{"mode":{"const":"public_fixture_work_lido"},"recordId":{"format":"uri","maxLength":2048,"minLength":1,"type":"string","x-stream-max-utf8-bytes":2048},"sourceDeclaration":{"additionalProperties":false,"properties":{"declaredAuthor":{"format":"uri","maxLength":2048,"minLength":1,"type":"string","x-stream-max-utf8-bytes":2048},"id":{"format":"uri","maxLength":2048,"minLength":1,"type":"string","x-stream-max-utf8-bytes":2048}},"required":["id","declaredAuthor"],"type":"object"},"statements":{"items":{"oneOf":[{"additionalProperties":false,"properties":{"authorId":{"format":"uri","maxLength":2048,"minLength":1,"type":"string","x-stream-max-utf8-bytes":2048},"kind":{"const":"documentLanguage"},"value":{"maxLength":16,"minLength":1,"pattern":"^[A-Za-z]{2,3}(?:-[A-Za-z]{4})?(?:-(?:[A-Za-z]{2}|[0-9]{3}))?$","type":"string","x-stream-max-utf8-bytes":16}},"required":["authorId","kind","value"],"type":"object"},{"additionalProperties":false,"properties":{"authorId":{"format":"uri","maxLength":2048,"minLength":1,"type":"string","x-stream-max-utf8-bytes":2048},"kind":{"const":"objectWorkType"},"language":{"maxLength":16,"minLength":1,"pattern":"^[A-Za-z]{2,3}(?:-[A-Za-z]{4})?(?:-(?:[A-Za-z]{2}|[0-9]{3}))?$","type":"string","x-stream-max-utf8-bytes":16},"value":{"maxLength":1024,"minLength":1,"type":"string","x-stream-max-utf8-bytes":1024}},"required":["authorId","kind","value","language"],"type":"object"},{"additionalProperties":false,"properties":{"authorId":{"format":"uri","maxLength":2048,"minLength":1,"type":"string","x-stream-max-utf8-bytes":2048},"kind":{"const":"workLabel"},"language":{"maxLength":16,"minLength":1,"pattern":"^[A-Za-z]{2,3}(?:-[A-Za-z]{4})?(?:-(?:[A-Za-z]{2}|[0-9]{3}))?$","type":"string","x-stream-max-utf8-bytes":16},"target":{"const":"work"},"value":{"maxLength":1024,"minLength":1,"type":"string","x-stream-max-utf8-bytes":1024}},"required":["authorId","kind","value","language","target"],"type":"object"},{"additionalProperties":false,"properties":{"artistId":{"not":{"const":"0x0000000000000000000000000000000000000000000000000000000000000000"},"pattern":"^0x[0-9a-f]{64}$","type":"string"},"association":{"additionalProperties":false,"properties":{"bindingGeneration":{"pattern":"^[1-9][0-9]{0,77}$","type":"string","x-stream-maximum":"18446744073709551615"},"bindingHash":{"not":{"const":"0x0000000000000000000000000000000000000000000000000000000000000000"},"pattern":"^0x[0-9a-f]{64}$","type":"string"}},"required":["bindingGeneration","bindingHash"],"type":"object"},"authorId":{"format":"uri","maxLength":2048,"minLength":1,"type":"string","x-stream-max-utf8-bytes":2048},"kind":{"const":"artistName"},"language":{"maxLength":16,"minLength":1,"pattern":"^[A-Za-z]{2,3}(?:-[A-Za-z]{4})?(?:-(?:[A-Za-z]{2}|[0-9]{3}))?$","type":"string","x-stream-max-utf8-bytes":16},"value":{"maxLength":1024,"minLength":1,"type":"string","x-stream-max-utf8-bytes":1024}},"required":["authorId","kind","value","language","artistId","association"],"type":"object"},{"additionalProperties":false,"properties":{"authorId":{"format":"uri","maxLength":2048,"minLength":1,"type":"string","x-stream-max-utf8-bytes":2048},"id":{"format":"uri","maxLength":2048,"minLength":1,"type":"string","x-stream-max-utf8-bytes":2048},"kind":{"const":"exportPublisher"},"language":{"maxLength":16,"minLength":1,"pattern":"^[A-Za-z]{2,3}(?:-[A-Za-z]{4})?(?:-(?:[A-Za-z]{2}|[0-9]{3}))?$","type":"string","x-stream-max-utf8-bytes":16},"name":{"maxLength":1024,"minLength":1,"type":"string","x-stream-max-utf8-bytes":1024}},"required":["authorId","kind","id","name","language"],"type":"object"}]},"maxItems":5,"type":"array"},"subjectId":{"not":{"const":"0x0000000000000000000000000000000000000000000000000000000000000000"},"pattern":"^0x[0-9a-f]{64}$","type":"string"},"version":{"const":"1"},"workId":{"format":"uri","maxLength":2048,"minLength":1,"type":"string","x-stream-max-utf8-bytes":2048},"workPayloadHash":{"not":{"const":"0x0000000000000000000000000000000000000000000000000000000000000000"},"pattern":"^0x[0-9a-f]{64}$","type":"string"}},"required":["mode","version","subjectId","workPayloadHash","workId","recordId","sourceDeclaration","statements"],"title":"STREAM_WORK_LIDO_FIXTURE_CONTEXT_V1","type":"object"}