{"mode":"public_fixture_work_lido","recordId":"urn:fixture:lido-record","sourceDeclaration":{"declaredAuthor":"urn:fixture:work-description-author","id":"urn:fixture:work-source"},"statements":[{"authorId":"urn:fixture:cataloguer","kind":"documentLanguage","value":"und"},{"authorId":"urn:fixture:cataloguer","kind":"objectWorkType","language":"en","value":"artwork"},{"authorId":"urn:fixture:publisher-declarant","id":"urn:fixture:export-publisher","kind":"exportPublisher","language":"en","name":"Public fixture export publisher"}],"subjectId":"0x0000000000000000000000000000000000000000000000000000000000000001","version":"1","workId":"urn:fixture:work","workPayloadHash":"0x9384b20ebe909b7218de87975f16109cb9a8e1db89d90d6d9e71c15dfa08fd71"}